{"artifacts_ref":"releases/0.1.0/ARTIFACTS.sha256","authority":"projection","doc_hash":"sha256:478e65fb55decebc8d932433822d8c5e73406fe2b3f8eed83cc8a06b649c68bc","doc_id":"P1-Kernel","doc_path":"publications/publication-I-pure-kernel/P1-Kernel.md","hash_alg":"sha256","release":"0.1.0","schema":"atomic-kernel.doc.badge/1","verify_mode":"hash-match","version":1}
